<?xml version="1.0" encoding="UTF-8"?>
<list xmlns:xsi="http://www.w3.org/2001/XMLSchema-instance" xsi:noNamespaceSchemaLocation="../xsd/skillTrees.xsd">
	<skillTree type="subClassSkillTree">
		<skill skillName="Sub - P. Atk./M. Atk. Increase" skillId="1956" skillLvl="1" getLevel="1">
			<item id="10280" count="1" />
		</skill>
		<skill skillName="Sub - P. Atk./M. Atk. Increase" skillId="1956" skillLvl="2" getLevel="1">
			<item id="10280" count="1" />
		</skill>
		<skill skillName="Sub - P. Atk./M. Atk. Increase" skillId="1956" skillLvl="3" getLevel="1">
			<item id="10280" count="1" />
		</skill>
		<skill skillName="Sub - P. Atk./M. Atk. Increase" skillId="1956" skillLvl="4" getLevel="1">
			<item id="10280" count="1" />
		</skill>
		<skill skillName="Sub - P. Def./M. Def. Increase" skillId="1957" skillLvl="1" getLevel="1">
			<item id="10280" count="1" />
		</skill>
		<skill skillName="Sub - P. Def./M. Def. Increase" skillId="1957" skillLvl="2" getLevel="1">
			<item id="10280" count="1" />
		</skill>
		<skill skillName="Sub - P. Def./M. Def. Increase" skillId="1957" skillLvl="3" getLevel="1">
			<item id="10280" count="1" />
		</skill>
		<skill skillName="Sub - P. Def./M. Def. Increase" skillId="1957" skillLvl="4" getLevel="1">
			<item id="10280" count="1" />
		</skill>
		<skill skillName="Sub - Atk. Spd./Casting Spd. Increase" skillId="1958" skillLvl="1" getLevel="1">
			<item id="10280" count="1" />
		</skill>
		<skill skillName="Sub - Atk. Spd./Casting Spd. Increase" skillId="1958" skillLvl="2" getLevel="1">
			<item id="10280" count="1" />
		</skill>
		<skill skillName="Sub - Atk. Spd./Casting Spd. Increase" skillId="1958" skillLvl="3" getLevel="1">
			<item id="10280" count="1" />
		</skill>
		<skill skillName="Sub - Atk. Spd./Casting Spd. Increase" skillId="1958" skillLvl="4" getLevel="1">
			<item id="10280" count="1" />
		</skill>
		<skill skillName="Sub - Critical Rate Increase" skillId="1959" skillLvl="1" getLevel="1">
			<item id="10280" count="1" />
		</skill>
		<skill skillName="Sub - Critical Rate Increase" skillId="1959" skillLvl="2" getLevel="1">
			<item id="10280" count="1" />
		</skill>
		<skill skillName="Sub - Critical Rate Increase" skillId="1959" skillLvl="3" getLevel="1">
			<item id="10280" count="1" />
		</skill>
		<skill skillName="Sub - Critical Rate Increase" skillId="1959" skillLvl="4" getLevel="1">
			<item id="10280" count="1" />
		</skill>
		<skill skillName="Sub - P. Accuracy/ M. Accuracy Increase" skillId="1960" skillLvl="1" getLevel="1">
			<item id="10280" count="1" />
		</skill>
		<skill skillName="Sub - P. Accuracy/ M. Accuracy Increase" skillId="1960" skillLvl="2" getLevel="1">
			<item id="10280" count="1" />
		</skill>
		<skill skillName="Sub - P. Accuracy/ M. Accuracy Increase" skillId="1960" skillLvl="3" getLevel="1">
			<item id="10280" count="1" />
		</skill>
		<skill skillName="Sub - P. Accuracy/ M. Accuracy Increase" skillId="1960" skillLvl="4" getLevel="1">
			<item id="10280" count="1" />
		</skill>
		<skill skillName="Sub - P. Evasion/ M. Evasion Increase" skillId="1961" skillLvl="1" getLevel="1">
			<item id="10280" count="1" />
		</skill>
		<skill skillName="Sub - P. Evasion/ M. Evasion Increase" skillId="1961" skillLvl="2" getLevel="1">
			<item id="10280" count="1" />
		</skill>
		<skill skillName="Sub - P. Evasion/ M. Evasion Increase" skillId="1961" skillLvl="3" getLevel="1">
			<item id="10280" count="1" />
		</skill>
		<skill skillName="Sub - P. Evasion/ M. Evasion Increase" skillId="1961" skillLvl="4" getLevel="1">
			<item id="10280" count="1" />
		</skill>
	</skillTree>
</list>