<?xml version="1.0" encoding="UTF-8"?>
<list xmlns:xsi="http://www.w3.org/2001/XMLSchema-instance" xsi:noNamespaceSchemaLocation="../xsd/skillTrees.xsd">
	<skillTree type="dualClassSkillTree">
		<skill skillName="Dual Certification - Attack" skillId="1962" skillLvl="1" getLevel="1">
			<item id="36078" count="1" />
		</skill>
		<skill skillName="Dual Certification - Attack" skillId="1962" skillLvl="2" getLevel="1">
			<item id="36078" count="1" />
		</skill>
		<skill skillName="Dual Certification - Attack" skillId="1962" skillLvl="3" getLevel="1">
			<item id="36078" count="1" />
		</skill>
		<skill skillName="Dual Certification - Attack" skillId="1962" skillLvl="4" getLevel="1">
			<item id="36078" count="1" />
		</skill>
		<skill skillName="Dual Certification - Berserker's Rage" skillId="1974" skillLvl="1" getLevel="1">
			<item id="36078" count="3" />
		</skill>
		<skill skillName="Dual Certification - Condition" skillId="1965" skillLvl="1" getLevel="1">
			<item id="36078" count="1" />
		</skill>
		<skill skillName="Dual Certification - Condition" skillId="1965" skillLvl="2" getLevel="1">
			<item id="36078" count="1" />
		</skill>
		<skill skillName="Dual Certification - Condition" skillId="1965" skillLvl="3" getLevel="1">
			<item id="36078" count="1" />
		</skill>
		<skill skillName="Dual Certification - Condition" skillId="1965" skillLvl="4" getLevel="1">
			<item id="36078" count="1" />
		</skill>
		<skill skillName="Dual Certification - Death" skillId="2000" skillLvl="1" getLevel="1">
			<item id="36078" count="2" />
		</skill>
		<skill skillName="Dual Certification - Defense" skillId="1963" skillLvl="1" getLevel="1">
			<item id="36078" count="1" />
		</skill>
		<skill skillName="Dual Certification - Defense" skillId="1963" skillLvl="2" getLevel="1">
			<item id="36078" count="1" />
		</skill>
		<skill skillName="Dual Certification - Defense" skillId="1963" skillLvl="3" getLevel="1">
			<item id="36078" count="1" />
		</skill>
		<skill skillName="Dual Certification - Defense" skillId="1963" skillLvl="4" getLevel="1">
			<item id="36078" count="1" />
		</skill>
		<skill skillName="Dual Certification - Light of Protection" skillId="1978" skillLvl="1" getLevel="1">
			<item id="36078" count="3" />
		</skill>
		<skill skillName="Dual Certification - Magical" skillId="1971" skillLvl="1" getLevel="1">
			<item id="36078" count="2" />
		</skill>
		<skill skillName="Dual Certification - Master's Rage" skillId="1976" skillLvl="1" getLevel="1">
			<item id="36078" count="3" />
		</skill>
		<skill skillName="Dual Certification - Physical" skillId="1970" skillLvl="1" getLevel="1">
			<item id="36078" count="2" />
		</skill>
		<skill skillName="Dual Certification - Recovery" skillId="1999" skillLvl="1" getLevel="1">
			<item id="36078" count="2" />
		</skill>
		<skill skillName="Dual Certification - Speed" skillId="1964" skillLvl="1" getLevel="1">
			<item id="36078" count="1" />
		</skill>
		<skill skillName="Dual Certification - Speed" skillId="1964" skillLvl="2" getLevel="1">
			<item id="36078" count="1" />
		</skill>
		<skill skillName="Dual Certification - Speed" skillId="1964" skillLvl="3" getLevel="1">
			<item id="36078" count="1" />
		</skill>
		<skill skillName="Dual Certification - Speed" skillId="1964" skillLvl="4" getLevel="1">
			<item id="36078" count="1" />
		</skill>
		<skill skillName="Dual Certification - Vampiric" skillId="1968" skillLvl="1" getLevel="1">
			<item id="36078" count="2" />
		</skill>
		<skill skillName="Dual Certification - Vital" skillId="1998" skillLvl="1" getLevel="1">
			<item id="36078" count="2" />
		</skill>
	</skillTree>
</list>